<!ELEMENT Data (Airport)*>
<!ELEMENT Airport (Airplane)*>
<!ATTLIST Airport
	ID		CDATA #REQUIRED
	x		CDATA #REQUIRED
	y		CDATA #REQUIRED
	SIZE	CDATA #REQUIRED
>
<!ELEMENT Airplane EMPTY>
<!ATTLIST Airplane
	ID		CDATA #REQUIRED
	SIZE 	CDATA #REQUIRED
>